{"$schema":"https://json-schema.org/draft/2020-12/schema","$id":"https://raw.githubusercontent.com/KxSystems/aimeta/main/aimeta/meta.schema.json","title":"aimeta meta.json (schemaVersion 3)","description":"Canonical schema for the JSON document served at GET /meta by an aimeta-enabled kdb+ process. See SPEC.md in the source repo for the prose specification.","type":"object","required":["schemaVersion","compilerVersion","process","tables","references","functions"],"additionalProperties":false,"properties":{"schemaVersion":{"const":3,"description":"Single-integer version of the closed meta.json shape. Bumped when a new field would be rejected by the prior schema or an existing field changes incompatibly."},"compilerVersion":{"type":"string","description":"Semver string identifying the build of the aimeta compiler that produced this file. Distinct from schemaVersion: schemaVersion tracks the wire shape, compilerVersion tracks the implementation."},"process":{"$ref":"#/$defs/Process"},"tables":{"type":"array","items":{"$ref":"#/$defs/Table"}},"references":{"type":"array","items":{"$ref":"#/$defs/Reference"}},"functions":{"type":"array","items":{"$ref":"#/$defs/Function"}}},"$defs":{"Process":{"type":"object","required":["name"],"additionalProperties":false,"properties":{"name":{"type":"string","description":"Process name. Stamped at compile time from the PROCESS_NAME module constant."},"host":{"type":"string","description":"Populated only when the process is running."},"port":{"type":"integer","description":"Populated only when the process is running."},"compileStatus":{"type":"string","enum":["failed","empty"],"description":"Present only when init[]'s compile-on-boot path degraded to synthesised Tier-1 metadata. 'failed' means compile errored out (rule violation, parse error, etc.); 'empty' means compile succeeded but emitted no public tables or functions (typically an unannotated source). Absent in normal compile-succeeded-with-content output. Consumers can branch on its presence/value to detect degraded mode and the reason."},"warnings":{"type":"array","items":{"type":"string"},"description":"Free-form diagnostics stamped alongside compileStatus when the runtime degrades to synthesised Tier-1 output (e.g. the captured compile error or 'no public surface' note). Absent in normal compile-succeeded-with-content output."}}},"Table":{"type":"object","required":["name","private","desc","columns"],"additionalProperties":false,"properties":{"name":{"type":"string"},"private":{"type":"boolean","description":"true when the table carries @private; included in meta.json but flagged internal."},"desc":{"type":"string"},"reference":{"type":["string","null"],"description":"Vocabulary name when this is an @reference table. Compiler-generated meta.json omits the field for non-reference tables; hand-authored fixtures may use null."},"labels":{"type":"array","items":{"type":"string"},"description":"Ordered @label column names; present only when reference is set."},"columns":{"type":"array","items":{"$ref":"#/$defs/Column"}},"sampleData":{"type":"array","items":{"type":"object"},"description":"Inline sample rows; field omitted when no @sampleRow."},"tags":{"type":"array","items":{"type":"string"},"description":"Free-form labels; field omitted when no @tag."}}},"Column":{"type":"object","required":["name","kdbType"],"additionalProperties":false,"properties":{"name":{"type":"string"},"kdbType":{"type":"string","description":"Single-character q type code (e.g. 's' symbol, 'f' float, 'p' timestamp). Unknown qdoc type names pass through verbatim and surface as a validator warning, so this field is not strictly single-character in degraded cases."},"desc":{"type":"string"},"semanticType":{"type":"string","description":"Vocabulary tag (e.g. 'currency', 'instrument'). Pairs with an @reference table on the same vocabulary."},"foreignRef":{"type":"string","description":"tableName.columnName syntax. Declares an explicit foreign-key edge."},"cardinality":{"enum":["low","medium","high"]},"attributes":{"type":"array","items":{"type":"string","enum":["s","u","p","g"]},"description":"kdb+ column attributes (sorted/unique/parted/grouped). Field omitted when none."},"label":{"type":"boolean","const":true,"description":"true when the column is a human-readable label on an @reference table; field omitted otherwise."}}},"Reference":{"type":"object","required":["semanticType","table","keyColumn","label","labels"],"additionalProperties":false,"properties":{"semanticType":{"type":"string"},"table":{"type":"string"},"keyColumn":{"type":"string","description":"Name of the @attr:u column on the resolver table."},"label":{"type":["string","null"],"description":"Primary @label column; null when none."},"labels":{"type":"array","items":{"type":"string"},"description":"All @label columns, primary first."}}},"Function":{"type":"object","required":["name","desc","params","returns","examples","uses","tags"],"additionalProperties":false,"properties":{"name":{"type":"string"},"desc":{"type":"string"},"params":{"type":"array","items":{"$ref":"#/$defs/Param"}},"returns":{"$ref":"#/$defs/Returns"},"examples":{"type":"array","items":{"type":"string"},"description":"Opaque illustrative call examples. Never executed by the compiler; may include shorthand."},"uses":{"type":"array","items":{"type":"string"},"description":"Table dependency set, derived from @uses."},"authorize":{"$ref":"#/$defs/Authorization","description":"Informative grant requirement derived from @authorize. It does not prove that the caller holds the grant or that the function enforces it; enforcement is the responsibility of a policy module or gateway."},"tags":{"type":"array","items":{"type":"string"}}}},"Authorization":{"type":"object","required":["action","resource"],"additionalProperties":false,"properties":{"action":{"type":"string","minLength":1,"pattern":"^[A-Za-z0-9._-]+$","description":"Grant verb, such as read or exec. Informative only."},"resource":{"type":"string","minLength":1,"pattern":"^[A-Za-z0-9._-]+$","description":"Grant resource, such as data.trade or analytic. Informative only."}}},"Param":{"type":"object","required":["name","type","desc"],"additionalProperties":false,"properties":{"name":{"type":"string"},"type":{"type":"string","description":"qdoc type string, preserved verbatim (e.g. 'symbol[]', 'date', 'timespan')."},"desc":{"type":"string"}}},"Returns":{"type":"object","required":["type","desc"],"additionalProperties":false,"properties":{"type":{"type":"string"},"desc":{"type":"string"}}}}}
