{"schemaVersion":3,"compilerVersion":"0.2.0","process":{"name":"host"},"tables":[{"name":"instruments","private":false,"desc":"Reference data for the instruments traded.","columns":[{"name":"sym","kdbType":"s","desc":"Instrument symbol."},{"name":"sector","kdbType":"s","desc":"Business sector."}]},{"name":"trades","private":false,"desc":"Executed trades, one row per fill.","columns":[{"name":"sym","kdbType":"s","desc":"Instrument symbol.","semanticType":"instrument","foreignRef":"instruments.sym"},{"name":"price","kdbType":"f","desc":"Execution price."},{"name":"size","kdbType":"j","desc":"Executed quantity."}]}],"references":[],"functions":[{"name":".demo.vwap","desc":"Volume-weighted average price per symbol.","params":[{"name":"syms","type":"symbol[]","desc":"Instrument symbols to include."}],"returns":{"type":"table","desc":"Symbol-keyed table with one vwap column."},"examples":[],"uses":["trades"],"authorize":{"action":"read","resource":"data.trades"},"tags":[]}]}
